{
  "$schema": "../../plugin-sdk/plugin.schema.json",
  "contract": 1,
  "id": "office365-oauth",
  "name": "Office 365 OAuth",
  "version": "1.0.0",
  "capabilities": [
    "auth_provider"
  ],
  "addr": "127.0.0.1:19002",
  "command": [
    "./office365-oauth"
  ],
  "env": [
    "AZURE_CLIENT_ID",
    "AZURE_CLIENT_SECRET",
    "AZURE_TENANT_ID",
    "DASHBOARD_URL",
    "DASHBOARD_AUTH_PLUGIN_SECRET",
    "OFFICE365_ALLOWED_GROUP_ID"
  ]
}
